Title,Time,Link,Subdomain,Sentiment
The Real Estate Nightmare in Downtown St. Louis,2024-04-09 21:27,https://www.wsj.com/real-estate/commercial/doom-loop-st-louis-44505465?mod=business_whatsnews_pos4,Real-Estate,0
Musk and Dimon’s AI Predictions and What They Mean for Humanity’s Future,2024-04-10 16:27,https://www.wsj.com/tech/ai/elon-musk-and-jamie-dimons-ai-predictions-and-what-they-mean-for-the-future-of-humanity-d100b0c8?mod=business_whatsnews_pos5,Business,2
Buy the Stock Market’s Inflation Freakouts,2024-04-10 18:27,https://www.wsj.com/finance/stocks/buy-the-stock-markets-inflation-freakouts-5c1e99de?mod=finance_lead_story,Finance,2
Germany Passed its First Chinese Test—This One Is Trickier,2024-04-10 08:27,https://www.wsj.com/economy/trade/germany-passed-its-first-chinese-testthis-one-is-trickier-740ae21b?mod=finance_lead_pos1,Economy,0
StraightPath Receiver Lays Out Investor Distribution Plan,2024-04-10 19:27,https://www.wsj.com/articles/straightpath-receiver-lays-out-investor-distribution-plan-63bf7e8a?mod=finance_lead_pos2,Articles,2
Inflation Surprise Rattles Markets,2024-04-10 17:27,https://www.wsj.com/finance/stocks/global-stocks-markets-dow-news-04-10-2024-a672a5bc?mod=finance_lead_pos3,Finance,0
Top Crypto Exchanges Look to Move Beyond Settlements With U.S. Regulators,2024-04-10 17:27,https://www.wsj.com/articles/top-crypto-exchanges-look-to-move-beyond-settlements-with-u-s-regulators-fddbeb29?mod=finance_lead_pos4,Articles,2
"U.S. Crude Oil Supplies Rise More Than Expected, Refinery Use Eases",2024-04-10 11:27,https://www.wsj.com/finance/commodities-futures/u-s-crude-oil-inventories-rise-more-than-expected-refinery-use-eases-14be060a?mod=finance_lead_pos5,Finance,2
The Billionaire Behind Trump’s $175 Million Bond Is No Stranger to Risky Deals,2024-04-10 16:27,https://www.wsj.com/real-estate/the-billionaire-behind-trumps-175-million-bond-is-no-stranger-to-risky-deals-484bbde4?mod=real-estate_lead_story,Real-Estate,2
An Alabama Oral Surgeon Designed His Nearly $5 Million Dream Mansion Using Home-Building Software,2024-04-10 15:27,https://www.wsj.com/real-estate/luxury-homes/an-alabama-oral-surgeon-designed-his-nearly-5-million-dream-mansion-using-home-building-software-051f80cb?mod=real-estate_lead_pos1,Real-Estate,2
The Real Estate Nightmare Unfolding in Downtown St. Louis,2024-04-09 21:27,https://www.wsj.com/real-estate/commercial/doom-loop-st-louis-44505465?mod=real-estate_lead_pos2,Real-Estate,0
Elon Musk Bromance With Argentine President Leads to First Meeting,2024-04-11 18:08,https://www.wsj.com/business/elon-musk-bromance-with-argentine-president-leads-to-first-meeting-d70204fe?mod=business_lead_story,Business,1
A Chip Fab Business Grows in Brooklyn,2024-04-11 17:08,https://www.wsj.com/articles/a-chip-fab-businessgrows-in-brooklyn-c5433a94?mod=business_lead_pos1,Articles,2
"Boeing Reveals Executives Got an Extra $500,000 in Private-Jet Perks",2024-04-11 16:08,https://www.wsj.com/business/boeing-finds-executives-got-an-extra-500-000-in-perks-from-private-jets-9bebe829?mod=business_lead_pos2,Business,0
"CarMax Gets Slammed by High Rates, Tight Used-Car Supply",2024-04-11 12:08,https://www.wsj.com/business/autos/carmax-gets-slammed-by-high-rates-tight-used-car-supply-6280d4cd?mod=business_lead_pos3,Business,0
Lufthansa Halts Tehran Flights After U.S. Warns of Imminent Attack on Israel by Iran,2024-04-11 11:08,https://www.wsj.com/business/lufthansa-halts-tehran-flights-amid-concerns-of-potential-iran-attacks-5b87cc43?mod=business_lead_pos4,Business,0
The Man in Charge of Getting the Baltimore Port Back in Business,2024-04-11 10:08,https://www.wsj.com/business/logistics/jonathan-daniels-francis-scott-key-bridge-port-operations-7246dc80?mod=business_lead_pos5,Business,2
Biden’s Green-Energy Price Shock,2024-04-11 00:00,https://www.wsj.com/articles/electricity-prices-biden-green-energy-labor-department-2b4ea2cb?mod=business_trendingnow_opn_pos1,Articles,0
The Podcast Host Who Also Manages a $1.6 Trillion Investment Fund,2024-04-11 00:00,https://www.wsj.com/business/the-podcast-host-who-also-manages-a-1-6-trillion-investment-fund-e7eef35f?mod=business_trendingnow_article_pos1,Business,2
Should You Buy a Hybrid Car? Here’s What You Need to Know,2024-04-11 08:08,https://www.wsj.com/lifestyle/cars/hybrid-car-is-it-worth-it-69adc329?mod=business_trendingnow_article_pos2,Articles,2
Amazon CEO Touts AI Revolution While Committing to Cost Cuts,2024-04-11 10:08,https://www.wsj.com/tech/ai/amazon-ceo-says-generative-ai-could-be-largest-technological-transformation-since-the-internet-da57c68f?mod=business_trendingnow_article_pos4,Business,2
Psychedelics Paid for by Work? It’s Coming,2024-04-11 16:08,https://www.wsj.com/health/wellness/will-your-health-benefits-cover-psychedelic-therapy-some-employers-say-yes-4bf810fe?mod=business_trendingnow_article_pos5,Health,2
Israel Wins Gaza Battles but Risks Losing the War,2024-04-11 23:08,https://www.wsj.com/world/middle-east/israel-wins-gaza-battles-but-risks-losing-the-war-c6a3823f?mod=business_whatsnews_pos1,Politics,0
Interest Rates Have Investors Worried. Profits Give Them Comfort.,2024-04-11 23:08,https://www.wsj.com/finance/interest-rates-have-investors-worried-profits-give-them-comfort-c4abb6cb?mod=business_whatsnews_pos2,Finance,2
Morgan Stanley’s Wealth Arm Probed by Multiple Federal Regulators,2024-04-11 16:08,https://www.wsj.com/finance/regulation/morgan-stanleys-wealth-arm-probed-by-multiple-federal-regulators-3d0dd46a?mod=business_whatsnews_pos3,Finance,0
Iranian Attack Expected on Israel in Next Two Days,2024-04-11 20:08,https://www.wsj.com/world/middle-east/iranian-attack-expected-on-israel-in-next-two-days-42b0537c?mod=business_whatsnews_pos4,Politics,0
Stay Put or Pay Up: Home Buyers Lose Hope for Lower Rates,2024-04-11 21:08,https://www.wsj.com/economy/housing/mortgage-rates-home-buyers-plans-changing-4b4b5a23?mod=business_whatsnews_pos5,Economy,0
Tech Stock Rebound Sends Nasdaq Composite to New Record,2024-04-11 17:08,https://www.wsj.com/finance/stocks/global-stocks-markets-dow-news-04-11-2024-3ae3c49b?mod=finance_lead_pos1,Finance,4
Banks Start Reporting Earnings This Week. Here’s What To Expect.,2024-04-11 06:08,https://www.wsj.com/finance/banking/bank-earnings-stocks-jpmorgan-goldman-citigroup-ed8936bd?mod=finance_lead_pos2,Finance,2
"Fed Rate Cuts Are Now a Matter of If, Not Just When",2024-04-11 16:08,https://www.wsj.com/economy/central-banking/fed-rate-cuts-are-now-a-matter-of-if-not-just-when-144a978e?mod=finance_lead_pos3,Economy,2
Mortgage Rates Near 7% Again,2024-04-11 13:08,https://www.wsj.com/economy/housing/mortgage-rates-near-7-again-cd1dfae0?mod=finance_lead_pos4,Economy,0
Expiring 2017 Trump Tax Cuts Create a Chance for Reform,2024-04-11 23:08,https://www.wsj.com/articles/expiring-trump-tax-cuts-create-a-chance-for-reform-2017-legislation-362f352e?mod=finance_trendingnow_opn_pos1,Articles,2
Let Americans Bank Again,2024-04-11 23:08,https://www.wsj.com/articles/let-americans-bank-again-42e2a002?mod=finance_trendingnow_opn_pos2,Articles,4
This $77 Million Aspen Ranch is Colorado’s Most Expensive Home—For Now,2024-04-11 17:08,https://www.wsj.com/real-estate/luxury-homes/this-77-million-aspen-ranch-is-colorados-most-expensive-homefor-now-5ccb5385?mod=real-estate_lead_story,Real-Estate,2
Late Designer Max Azria’s Massive Compound Is Heading to Auction,2024-04-11 13:08,https://www.wsj.com/real-estate/luxury-homes/late-designer-max-azrias-massive-compound-is-heading-to-auction-bddbbb20?mod=real-estate_lead_pos1,Real-Estate,2
The Party’s Over for Coachella’s Glitziest Rental Mansions,2024-04-11 00:00,https://www.wsj.com/real-estate/luxury-homes/the-partys-over-for-coachellas-glitziest-rental-mansions-322b3d75?mod=real-estate_lead_pos2,Real-Estate,0
Movie Theaters Have Weird Real Estate. It’s Saving Them.,2024-04-08 00:00,https://www.wsj.com/real-estate/commercial/movie-theaters-have-weird-real-estate-its-saving-them-8053335f?mod=real-estate_trendingnow_article_pos5,Real-Estate,2
